{
  "contract_version": "normalized-research-signal/v1",
  "signal_id": "art-history:entity-001",
  "signal_kind": "art-history",
  "source": {
    "repository": "art-history",
    "commit": "d5d4397752f3fb2d18c1bdbbdfd6962b00dbb8d7",
    "entity_ids": ["art-entity-001"],
    "locators": ["entities/art-entity-001"]
  },
  "statement": "The canonical art-history entity has a documented relation.",
  "evidence_refs": [
    {
      "locator": "art-history/evidence/source-001",
      "kind": "primary",
      "entity_id": "art-entity-001"
    }
  ],
  "certainty": {
    "level": "observed",
    "basis": "The relation is recorded with a source evidence locator."
  },
  "unknowns": ["The signal does not reproduce the complete canonical graph."],
  "constraints": ["Use the canonical graph locator for additional context."],
  "validity": {
    "status": "valid",
    "checked_at": "2026-08-11T15:00:00+09:00"
  },
  "freshness": {
    "status": "current",
    "retrieved_at": "2026-08-11T15:00:00+09:00",
    "revalidate_at": "2026-12-11T15:00:00+09:00"
  },
  "adapter": {
    "name": "art-history-export",
    "version": "1.0.0"
  },
  "generated_at": "2026-08-11T15:00:00+09:00",
  "domain": {
    "art_history": {
      "entity_kind": "artwork",
      "time": "20th-century",
      "geo": "unspecified-region",
      "relations": [
        {
          "target_entity_id": "artist-entity-001",
          "relation": "created-by",
          "certainty": {
            "level": "inferred",
            "basis": "The child graph records the relation with evidence."
          },
          "evidence_refs": ["art-history/evidence/source-001"]
        }
      ],
      "canonical_graph_locator": "art-history/graph/art-entity-001"
    }
  }
}
